"系統序號","課程名稱","課程大綱","A分數","A判定理由","B分數","B判定理由","C分數","C判定理由","D分數","D判定理由","整體判定","主要依據","證據不足處"
"8194146","創新媒體與創意","""隨著生成式AI(Gen-AI)、XR與虛擬製作(Virtual Production)等技術導入; 影音媒體產業將經歷重大轉型;觀眾持續增加跨平台影音使用;應用GenAI、虛擬科技將帶來影音創新及創意突破:加速新型態影音產製速度;提升內容沉浸感和社交臨場感。透過新興科技加持的新形態影音;若能結合適當品牌策略與跨平台社群行銷;創新影音內容得以迅速擴散;快速吸引觀眾目光;增強網路聲量和影響力。    本課程以「影音創意」與「科技融合」為核心;本學期與專家產學合作;教導同學如何創造虛擬角色(virtual avatars or influencers);並將其應用於影音內容;結合社群媒體行銷;進而經營自媒體品牌;用來達到有效溝通台灣重要議題之策略目的。課程目標是讓學生執行創新影音專案時;學習到企劃、提案、製作、經營、社群互動和數據分析等整合實務經驗;嘗試為觀眾帶來沉浸式、擬人化之社交影音體驗。    同學將組成創意製作小組;共同創作Avatar。透過策略性經營自媒體品牌;可針對台灣文化、社會關懷、永續發展SDGs、地方創生、人權性平等主題發揮;須超越泛娛樂化和個人秀網紅形式;需有知識內容含金量+觀眾互動反饋+社會實踐。同學將嘗試以虛擬角色結合生成式AI工具;策劃、製作與推播影音及社群內容;再搭配跨平台行銷手法;藉以讓內容迅速擴散;進而引發關注與互動。         課程規劃分為兩大主軸:       知識理解:認識AI與XR等新興技術對影音產製與行銷模式的影響;聚焦於掌握虛擬角色製作與生成式AI科技趨勢和發展脈絡。   實作應用:學生將學習虛擬角色製作及GenAI工具使用;經營小組自媒體品牌;透過社群平台行銷推廣、觀眾互動與數據回饋進行成效分析;完整體驗內容企劃、製作、經營與評估的流程。      本課程結合產學合作;邀請業界專家指導學生從創建虛擬角色、運用新科技製作實驗性創新影音與社群內容;並獲得專業回饋。學生將在實作與發表中累積新媒體時代所需的跨域創意與實戰能力;達成「學中做、做中學」的目標;為未來媒體職涯鋪路。  ""","3","課程明確要求學生認識AI與XR對影音產製及行銷模式的影響，掌握虛擬角色製作與生成式AI趨勢，並實際使用GenAI工具創作影音及社群內容；但未明確涉及以AI規劃個人學習或自主調整學習歷程。","1","課程涉及台灣文化、社會關懷、永續發展、人權性平等與社會實踐等議題，但未明確連結AI倫理、法規、個資、偏誤、資安、使用揭露或責任治理。","5","學生以小組形式創作Avatar，使用生成式AI策劃、製作與推播影音及社群內容，並透過社群互動、觀眾回饋與數據分析進行成效評估，完整經歷企劃、製作、經營與評估流程，且有業界專業回饋。","4","課程要求學生以小組合作創作虛擬角色，結合台灣文化、社會關懷、人權性平等與社會實踐，並透過觀眾互動及創意內容進行AI協作；但未明確要求提出人類判斷理由、驗證AI結果或承擔最終決策責任。","A=3;B=1;C=5;D=4","主要符合C與D，因課程有生成式AI實作、完整影音專案流程、團隊協作、觀眾互動、社會議題與創意整合。","B所需的AI倫理、法律、隱私、偏誤、風險與責任內容不足；A未明確安排AI學習規劃與反思，D未明確要求人類對AI結果進行查證或負最終責任。"
"8194162","計算思維與人工智慧","""本課程旨在介紹計算思維與人工智慧的基本概念、原理和應用;為之後修習資訊相關課程奠下基礎。21世紀數位時代;如何具有應用人工智慧技術能力;培養計算思維是第一步;因為計算思維是分析問題、制定解決方法的思考過程;其中解決的步驟得依循電腦運算邏輯;因此在有了抽象思考能力後;將進一步介紹電腦具體運作架構;兩者的結合將由人工智慧程式應用來加以練習;此外也將介紹人工智慧的發展歷程和未來趨勢;以及人工智慧對社會、經濟和文化的影響。          加退選說明: 若選課人數達上限135人;仍有多人候補;實習課週二晚上7~9隔週上課;必點名;所以時間不能配合;麻請退選;給後補同學機會;之後退簽;需具名特殊原因;不然不退簽。         ?加簽說明: 本學期不開放加簽;若加退選沒選上者;可於往後學期嘗試看看。         本課程會介紹程式;但不是全部;想要學程式設計;建議程式設計概論 / Programming 101by邱淑怡; 郭正佩       ""","3","課程明確介紹人工智慧的基本概念、原理、應用、發展歷程與未來趨勢，並透過人工智慧程式應用進行練習；符合AI工具與原理學習，但未明確安排以AI提升個人學習成效或自主學習歷程。","1","課程提及人工智慧對社會、經濟和文化的影響，但僅屬影響概述，未明確涵蓋AI倫理、法規、個資、資安、偏誤查證或責任治理。","3","課程將計算思維用於分析問題與制定解決方法，並以人工智慧程式應用加以練習；可證明學生接觸AI程式解決問題，但未明確說明專題、結果驗證、修正、人機分工或品質評估。","0","雖然課程涉及人工智慧程式應用與AI影響，但未將人類判斷、同理心、創意、真實場域觀察或人機協作中的主體性明確置於教學活動中。","A=3;B=1;C=3;D=0","主要依據是課程明確教授人工智慧基本概念、原理、應用與程式練習，並將計算思維用於問題分析與解決方法制定。","大綱未明確說明AI倫理與風險教學、結果驗證、人機協作、跨域專題、學習反思或AI情境下的人類核心能力。"
"8194163","計算思維與人工智慧","""This course aims to introduce fundamental concepts; principles; and applications of computational thinking and artificial intelligence; establishing a foundation for subsequent information technology-related coursework. In the 21st century digital era; developing computational thinking capabilities represents the essential first step toward effectively applying artificial intelligence technologies. Computational thinking encompasses the analytical processes for problem identification and solution formulation; wherein problem-solving procedures must adhere to computer operational logic. After developing abstract thinking skills; we will explore concrete computer operational architectures in more detail. The integration of these elements will be practiced through artificial intelligence programming applications. Additionally; we will investigate the developmental trajectory and future trends of artificial intelligence; and evaluate its impact on society; the economy; and culture.  ""","3","課程明確介紹人工智慧的基本概念、原理、應用、發展歷程與未來趨勢，並透過人工智慧程式應用進行練習；符合AI工具與原理學習，但未明確安排以AI提升個人學習成效或自主學習歷程。","1","課程提及人工智慧對社會、經濟和文化的影響，但僅屬影響概述，未明確涵蓋AI倫理、法規、個資、資安、偏誤查證或責任治理。","3","課程將計算思維用於分析問題與制定解決方法，並以人工智慧程式應用加以練習；可證明學生接觸AI程式解決問題，但未明確說明專題、結果驗證、修正、人機分工或品質評估。","0","雖然課程涉及人工智慧程式應用與AI影響，但未將人類判斷、同理心、創意、真實場域觀察或人機協作中的主體性明確置於教學活動中。","A=3;B=1;C=3;D=0","本課程與課程5的課名及大綱描述高度近似，依規定採用課程5的相同分數與判定。","大綱未明確說明AI倫理與風險教學、結果驗證、人機協作、跨域專題、學習反思或AI情境下的人類核心能力。"
"8194429","數位多媒體典藏應用","""人用感官感受到的訊息來描述這個世界與傳遞知識;文字與語言的發明使得溝通更有效率;也能用遠距的方式達到溝通的目的;並因此產生了文明;時至今日;數位內容透過網路與行動裝置;成為新媒體;資訊科技也讓多媒體資訊隨處可得甚至於可任意創造;本課程將介紹多媒體資料的數位化;如何透過Python進行數位資料的處理;尤其是最不容易解譯的影像與多媒體;生成式AI將在下半段的課程中簡介出來;包括文字生成-ChatGPT/圖片生成-Stable Diffusion/音樂生成/影片生成;除了探究如何典藏文明;也會介紹結合AI的現代式媒體。  ""","2","課程明確提到下半段介紹生成式AI，包括ChatGPT、Stable Diffusion、音樂生成及影片生成，符合AI工具與功能的基本接觸；但僅寫明簡介，未明確要求學生運用AI進行學習、提示設計或自主學習。","0","大綱未提及AI倫理、著作權、個資、資安、偏誤、查證、風險或責任歸屬，因此不能推定具備負責任使用AI能力。","1","課程提到生成式AI及結合AI的現代媒體，但未明確要求學生使用AI完成任務、作品或專業問題解決，因此僅屬AI應用背景介紹。","0","雖提到生成式AI與現代媒體，但未置於人類判斷、創意主體性、同理心、真實場域或人機協作的明確學習情境。","A=2;B=0;C=1;D=0","主要依據為課程明確介紹多種生成式AI工具及其媒體應用。","大綱未說明學生實際操作、成果評量、AI生成內容查證、著作權或人機分工。"
"8194435","檔案學研究","""本課程期許透過課程講授;建立學生對於檔案學研究內涵的瞭解;並藉由主題報告與討論;深化學生對於各項議題的反思與解決問題能力;同時導入實務機構專家之專題演講有助學生對於學理與實務之間的映證學習。課程大綱規劃:    1.檔案及檔案學概念    2.文書學與文書工作    3.檔案徵集與鑑定    4.檔案編排與描述    5.檔案分類及保存年限    6.檔案典藏與維護    7.人工智慧與檔案檢索    8.檔案檢調與應用    9.口述歷史檔案    10.電子檔案管理    11.檔案機構與專業教育    12.檔案專業倫理  ""","1","課程大綱列有「人工智慧與檔案檢索」，顯示學生會接觸AI相關技術與應用主題；但未明確說明使用AI作為學習工具或進行實作。","0","雖列有「檔案專業倫理」，但未明確與AI倫理、法規、個資、偏誤、資安、治理或責任連結，因此不能計入B。","1","「人工智慧與檔案檢索」涉及AI在檔案檢索中的應用，但未明確要求學生使用AI完成檢索任務、分析資料、驗證結果或提出方案。","0","大綱未將AI檔案檢索與人類判斷、主體性、同理溝通、真實場域洞察或創意整合明確連結。","A=1;B=0;C=1;D=0","主要依據為課程單元明列「人工智慧與檔案檢索」。","大綱未提供AI實作活動、評量方式、結果查證、風險管理或人機協作內容。"
"8195747","選修英文:科技英文","""In today&#39;s digital era; where information technology is ever-present and artificial intelligence is advancing rapidly; it is crucial for individuals to possess tech-savviness and stay updated with the latest IT trends. The English for Information Technology course is specifically tailored to introduce cutting-edge topics in information technology that directly align with the needs of the Millennials.     This one-semester 3-credit-hour course is designed for high-intermediate/advanced students of English as a foreign language. This isnota course that aims to teach students information technology knowledge. Rather; it is designed to allow students to transform their English language knowledge into the communication skills necessary for careers in the IT field orany profession.In addition; students are encouraged to think about and consider ethical issues and related topics in information technology. Students will also learn how to discover and discuss new and trending information technologies. A considerable emphasis will be put on training students to create an academic research poster on a topic on issues related to information technology.  ""","0","大綱僅在數位時代背景中提到人工智慧快速發展，課程並明確說明不以教授資訊科技知識為目的；未提及運用AI學習或選用AI工具。","0","大綱提到思考資訊科技的倫理議題，但未明確將其與AI倫理、法規、隱私、資安、偏誤或責任連結，因此不能計入B。","0","課程要求製作資訊科技議題的學術研究海報，但未明確要求使用AI進行分析、生成、建模或解決專業問題。","0","雖有溝通、研究海報及倫理議題，但未明確置於AI協作情境，不能依一般溝通、研究或創意活動給D分數。","A=0;B=0;C=0;D=0","課程僅將AI列為資訊科技發展背景，核心是科技英文溝通與研究海報製作。","大綱未提及AI工具實作、AI使用規範、AI結果查證、人機協作或人類主體性。"
"8196023","機率論","""   依照學校指示:雖然實體課程只有十六星期;但是依照本校正式公文通知與學則規定;每一學分仍然應該有十八小時的教學規畫。因此在課程網頁的每週規畫表格之前;列有相當規模的自習活動。這些自習活動並非可有可無;而與這一門課開學之後的教學息息相關;也都屬於小考、期中評量與期末評量的範圍。提醒選課同學必須自行複習所列之主題。   這是一門資訊科學系二年級的必修數學課程;課程設計也必須以此為目標。為了達成必要課程進度與銜接(例如 machine learning 和 data science);我們無法為同學複習高中與大學一年級應該學過的數學(參考先修課程); 建議非資訊科學系之修課同學衡量自己的狀況是否適合選修這一門課程。   我們鼓勵同學以大型語言模型;例如ChatGPT作為自己的學伴。歡迎大家自己測試一下大型語言模型是否能夠回答機率的題目;包含作業。但是大家需要注意:ChatGPT 的能力尚非完美;不見得能解所有問題;而且所給的答案不見得就是正確答案。各位可以嘗試用 ChatGPT 來解113年分科測驗數甲試題第3和第4題的題目;114學年度分科測驗試題數甲試題第12-14的題組看看 ChatGPT 是否提供了正確的答案和過程?   這是資訊科學系的必修課程;時間壓力特別大;最晚第二堂課就會出作業;九月十日的作業的繳交截止日是九月廿四日。      先修課程:相關高中數學基礎[排列、組合、機率];大一微積分[微分、積分、多重積分、分部積分(integration by parts)的技術]  ""","3","課程明確鼓勵學生以大型語言模型如ChatGPT作為學伴，並要求自行測試其回答機率題目的能力；具備AI輔助理解與練習的學習活動，但未明確涵蓋學習歷程規劃與持續調整。","2","課程明確提醒ChatGPT能力不完美、答案與過程不一定正確，涉及AI結果可靠性與不盲目相信；但未提及個資、著作權、偏誤、使用揭露或責任規範。","3","課程明確要求學生嘗試使用ChatGPT解答指定分科測驗機率題，並檢查其答案和解題過程是否正確，具備AI解題及結果驗證活動；但未說明方案比較、系統性修正或人機流程優化。","3","學生需檢查ChatGPT解答與過程的正確性，並依課程提醒判斷AI答案是否可靠，具有人類檢核與判斷的AI協作證據；但未明確要求說明決策理由或承擔最終責任。","A=3;B=2;C=3;D=3","主要依據為明確安排以ChatGPT作為學伴、測試其解題能力，並檢查答案與過程正確性。","大綱未提及AI倫理、法規、個資、著作權、使用揭露、偏誤處理、系統性修正或完整人機分工。"
"8196031","人機互動","""本課程旨在介紹人機互動之基礎概念;尤其著重於新近發展迅速的非傳統式人機介面;包含觸控、手寫、語音、手勢、肢體、眼動、腦波、行動平台、 擴增實境、虛擬實境、機器人與穿戴式裝置;AI 代理人等;藉由模組化的設計;帶領同學認識人機互動領域的相關主題。  ""","1","課程明確列出「AI代理人」作為非傳統式人機介面主題，屬於AI相關技術的介紹；但未明確要求運用AI進行學習或實作。","0","大綱未提及AI倫理、法規、隱私、資安、偏誤、風險、治理或責任歸屬，因此不能推定負責任使用AI能力。","0","雖將AI代理人列為人機互動主題，但未明確要求學生使用AI完成任務、分析問題、製作原型或驗證結果。","0","課程涉及人機互動，但未明確在AI協作情境中培養人類判斷、同理心、溝通、創意或真實世界洞察。","A=1;B=0;C=0;D=0","主要依據為課程主題明列「AI代理人」。","大綱未說明AI工具操作、倫理風險、實作評量、使用者研究或人機分工。"
"8196041","機器學習概論","""依照學校指示:雖然實體課程只有十六星期;但是依照本校正式公文通知與學則規定;每一學分仍然應該有十八小時的教學規畫。因此在課程網頁的每週規畫表格之前;列有相當規模的自習活動。這些自習活動並非可有可無;而與這一門課開學之後的教學息息相關;也都屬於期中評量與期末評量的範圍。提醒選課同學必須自行複習所列之主題。    這一課程以介紹機器學習與深度學習的基本觀念和相關應用為目的。機器學習是人工智慧領域的重要區塊;近年以來因為計算技術的急速進步;許多過去的理論已經變成實用的技術。這一課程透過介紹許多基本的概念;期望讓選課同學了解機器學習技術的基礎觀念;並且進一步學習如何應用公開軟體來處理實際問題。這一課程將介紹機器學習的數個基本型態;包含監督式學習、非監督式學習、迴歸分析、及以類神經網路為基礎的深度學習;並且延伸到大型模型的討論。    課程中以講解基礎學理為主;同時伴隨程式實例的簡介。在幾乎每一個星期都有的 Moodle 作業中經常會使用到以Python為主的程式實例;期待大家都能兼顧學理與實例。    雖然我們會帶到一些關鍵的Python指令或者套件;但是這不是一門學習 Python 的課程。Python是選修這一門課程的先備能力。體驗機器學習的核心功能;而不建構整個應用系統的話;並不需要學會所有的Python指令。當然如果能隨心所欲應用Python是最好的。    如果以Kaggle公開課程做為參考比較的話;在假設同學不需要太多 Python、Pandas和Numpy/Scipy的協助的前提之下;我們的課程計劃可以包含Intro to Machine Learning和Intermediate Machine Learning之外;還會接軌到深度學習入門Intro to Deep Learning的材料。2025學年可能繼續參考 Kaggle 的入門課程;也可能在開學之後更換對應目標;確定會有實作方向的對應目標。  ""","3","課程以機器學習與深度學習基本觀念及應用為目的，介紹監督式學習、非監督式學習、迴歸、深度學習及大型模型，並透過Python程式實例與Moodle作業學習；但課程以基礎學理講解為主，未明確涉及AI自主學習策略。","0","大綱未提及AI倫理、法規、隱私、資安、偏誤、查證、風險管理、治理或責任歸屬，因此不能推定負責任使用AI能力。","3","課程明確說明學習如何應用公開軟體處理實際問題，並以Python程式實例及幾乎每週的Moodle作業配合學理，且確定有實作方向；但未明確說明結果驗證、修正、品質控制、人機分工或流程優化。","0","雖涉及機器學習應用與程式實作，但大綱未明確要求學生在AI協作情境中進行人類判斷、同理溝通、真實場域觀察或創意整合。","A=3;B=0;C=3;D=0","主要依據為完整介紹機器學習與深度學習概念、應用及大型模型，並安排公開軟體、Python程式實例與作業實作。","大綱未提及AI倫理與風險，也未明確規劃模型結果驗證、偏誤修正、品質評估、人機分工或人類主體性。"
"8196045","數值方法","""本課程旨在教授數學基礎與程式基礎都欠缺的碩士生數值方法的基礎學習和應用;課程中會大量使用生成式AI合作並進一步將這些方法應用於財務數學領域。通過本課程;學生將學習如何利用數學工具來解決金融市場中的各種問題;掌握包括數值分析、時間序列分析、模糊邏輯、機器學習等在內的多種技術;並運用這些技術進行金融建模和預測。  ""","3","課程明確指出會大量使用生成式AI合作，並以數學工具、數值分析、時間序列分析、模糊邏輯及機器學習進行學習與應用，具備實際運用AI及相關工具的內容；但未明確說明工具選擇、提示策略或學習歷程調整。","0","大綱未提及AI倫理、法規、著作權、個資、資安、偏誤、查證或責任歸屬，因此不能推定具備負責任使用AI的能力。","4","課程要求運用生成式AI及數值分析、時間序列分析、模糊邏輯、機器學習等技術，進行財務數學應用、金融建模與預測，具有明確的AI協作及專業問題解決任務；但未提及結果驗證、錯誤修正、品質控制或人機分工。","0","雖明確提到生成式AI合作，但未要求學生進行人類判斷、批判驗證、創意整合、同理溝通或承擔最終決策責任，因此不能推定具備AI無法取代的能力。","A=3;B=0;C=4;D=0","主要符合A與C，因課程明確安排大量生成式AI合作，並將相關方法應用於金融建模與預測。","B完全缺乏AI倫理、風險與責任內容；D缺乏人類主體性、判斷、創意或同理心等AI協作證據；A亦未明確呈現提示策略或自主學習歷程。"
"8196053","數據分析在財務上的應用","""本課程結合理論與實務;系統性介紹股票、選擇權等交易商品;搭配Python及XQ程式交易軟體;培養學生的數位分析與程式實作能力;並深入探討技術分析、技術指標、基本面與總體經濟數據對股價的影響。進一步引入人工智慧應用於交易策略開發;培養自主學習與團隊合作能力。透過專題實作與策略分享;學生能熟悉完整的投資流程;強化規劃與應用能力;為未來金融實務或相關研究奠定堅實基礎。  ""","1","大綱提到將人工智慧應用於交易策略開發，並培養自主學習能力，但未明確說明以AI進行資訊整理、概念理解、回饋或學習規劃，因此僅給零星分數。","0","大綱未提及AI倫理、法規、著作權、個資、資安、偏誤、查證或責任歸屬，因此不能推定具備負責任使用AI的能力。","3","課程明確引入人工智慧進行交易策略開發，並安排專題實作、策略分享及完整投資流程，具備運用AI完成財務專業任務的證據；但未提及AI結果驗證、修正、方案比較或人機分工。","0","大綱雖提到團隊合作、自主學習與策略分享，但未明確置於AI協作中的人類判斷、同理溝通、創意整合或最終責任情境，因此不能給分。","A=1;B=0;C=3;D=0","主要符合C，因課程將人工智慧納入交易策略開發，並透過專題實作完成投資流程。","A缺乏AI輔助學習的具體活動；B未提及負責任使用AI；C未說明驗證與品質控制；D未提供AI協作下的人類主體性或不可取代能力證據。"
